{"contract_name":"securethecloud_suite_catalog","contract_version":"0.3.0-machine-contract-baseline","doctrine_phase":"Phase 3 / Shared Machine-Readable Contracts","last_updated":"2026-05-23","sharing_status":"active_machine_readable_contract","suites":[{"suite_id":"agent_blackbox","suite_name":"SecureTheCloud Agent Blackbox Suite","status":"customer_offerable","customer_offerable":true,"primary_role":"Agent behavior evidence, decision traceability, governed explanations, handoff context, trust intelligence summaries, and client demo/readiness packaging.","authority_posture":"Evidence, explanation, readiness, and packaging. No runtime mutation or enforcement authority by default.","shared_trust_fabric_dependencies":["suite_catalog","module_registry","authority_matrix","evidence_metadata","status_taxonomy","product_packaging_boundaries"]},{"suite_id":"compliance_evidence","suite_name":"SecureTheCloud Compliance Evidence Suite","status":"customer_offerable","customer_offerable":true,"primary_role":"SOC 2-aligned evidence packages, audit workspace, control traceability, evidence registers, export manifests, and auditor-facing summaries.","authority_posture":"Evidence recording, mapping, traceability, packaging, and presentation. No runtime enforcement authority by default.","shared_trust_fabric_dependencies":["evidence_taxonomy","soc2_traceability","module_authority_matrix","doctrine_lock","status_taxonomy"]},{"suite_id":"runtime_assurance","suite_name":"SecureTheCloud Runtime Assurance Suite","status":"customer_offerable","customer_offerable":true,"primary_role":"Runtime assurance doctrine, enforcement-readiness pathways, control-point routing, SENTINEL-backed decision posture, and production-boundary clarity.","authority_posture":"Runtime-impacting authority only when explicitly granted by doctrine, module authority matrix, deployment phase, and SENTINEL control-point rule.","shared_trust_fabric_dependencies":["authority_matrix","sentinel_control_point_rule","composition_rules","status_taxonomy","product_packaging_boundaries"]},{"suite_id":"risk_intelligence","suite_name":"SecureTheCloud Risk Intelligence Suite","status":"customer_offerable","customer_offerable":true,"primary_role":"Risk posture narratives, authority overlap analysis, control gap summaries, trust scoring context, and customer-safe risk intelligence.","authority_posture":"Analyze, score, explain, and summarize. No runtime mutation, authorization, or enforcement authority by default.","shared_trust_fabric_dependencies":["authority_registry","status_taxonomy","evidence_metadata","risk_control_traceability","product_packaging_boundaries"]}],"non_suite_substrates":[{"substrate_id":"shared_trust_fabric","name":"Shared Trust Fabric","status":"shared_fabric_dependency","customer_offerable":false,"role":"Shared doctrine, registries, schemas, contracts, taxonomy, evidence metadata, and traceability substrate used by all suites."},{"substrate_id":"doctrine_control_plane","name":"Doctrine Control Plane","status":"internal_doctrine_only","customer_offerable":false,"role":"This repository. It defines the portfolio doctrine and contract source of truth."}],"frozen_rules":["Only four customer-offerable suites are frozen in the baseline.","Shared Trust Fabric is not a fifth customer-offerable suite.","Suite membership does not create authority.","Packaging does not create authority.","Composition does not create authority.","SENTINEL remains canonical for runtime-impacting control decisions."]}
